{
    "$schema": "http://json-schema.org/draft-07/schema",
    "definitions": {
        "assays": {
            "type": "string",
            "enum": [
                "RdRp_SARSr",
                "ORF1ab",
                "2019-nCoV_N1",
                "PowerChek-E",
                "E_Sarbeco",
                "CCDC-ORF1ab",
                "CCDC-N",
                "HKU-N",
                "S",
                "?"
            ]
        }
    },
    "type": "object",
    "properties": {
        "key": {
            "type": "string",
            "description": "unique identifier for a dataset (typically the same as a publication)"
        },
        "doi": {
            "type": "string",
            "description": "digital object identifier to retrieve the publication or dataste"
        },
        "title": {
            "type": "string",
            "description": "title of the publication"
        },
        "assay": {
            "description": "assay or primer/probe set used to quantify RNA",
            "oneOf": [
                {
                    "$ref": "#/definitions/assays"
                },
                {
                    "type": "array",
                    "items": {
                        "$ref": "#/definitions/assays"
                    }
                }
            ]
        },
        "loq": {
            "type": [
                "number",
                "null"
            ],
            "description": "level of quantification, i.e. the smallest possible concentration that can be measured, or `null` if not available"
        },
        "patients": {
            "type": "object",
            "properties": {
                "n": {
                    "type": "integer",
                    "description": "number of patients in the study"
                },
                "positive": {
                    "type": "integer",
                    "description": "number of patients with at least one positive stool sample"
                },
                "negative": {
                    "type": "integer",
                    "description": "number of patients without any positive stool samples"
                },
                "details": {
                    "type": "array",
                    "description": "details about individual patients"
                }
            },
            "additionalProperties": false
        },
        "samples": {
            "type": "object",
            "properties": {
                "n": {
                    "type": "integer",
                    "description": "number of samples analysed in the study"
                },
                "positive": {
                    "type": "integer",
                    "description": "number of positive samples"
                },
                "negative": {
                    "type": "integer",
                    "description": "number of negative samples"
                }
            },
            "additionalProperties": false
        },
        "loads": {
            "type": "array",
            "items": {
                "type": "object",
                "properties": {
                    "value": {
                        "type": [
                            "number",
                            "null"
                        ],
                        "description": "viral load as log10 copies per mL"
                    },
                    "err": {
                        "type": [
                            "number",
                            "null"
                        ],
                        "description": "optional error estimate for the viral load value"
                    },
                    "day": {
                        "type": "integer",
                        "description": "day as reported by the study (often since symptom onset or hospital admission)"
                    },
                    "date": {
                        "type": "string",
                        "description": "specimen collection date"
                    },
                    "patient": {
                        "type": "integer",
                        "description": "zero-based unique patient identifier"
                    },
                    "threshold": {
                        "type": "number",
                        "description": "semi-quantitative qPCR cycle threshold"
                    },
                    "stage": {},
                    "severity": {}
                },
                "required": [
                    "value"
                ],
                "additionalProperties": false
            }
        }
    },
    "required": [
        "key",
        "doi",
        "assay",
        "title",
        "patients",
        "samples",
        "loq"
    ]
}
