{
    "$schema": "../../schema.json",
    "key": "Jeong et al. 2020",
    "doi": "10.1016/j.cmi.2020.07.020",
    "title": "Viable SARS-CoV-2 in various specimens from COVID-19 patients",
    "patients": {
        "n": 5,
        "positive": 3,
        "negative": 2
    },
    "samples": {
        "n": 5,
        "positive": 3,
        "negative": 2
    },
    "assay": "S",
    "loq": 0.3,
    "loads": [
        {
            "patient": 1,
            "stage": "recovery",
            "value": null,
            "err": null,
            "day": 8
        },
        {
            "patient": 2,
            "stage": "recovery",
            "value": 1.51,
            "err": 0.19,
            "day": 13
        },
        {
            "patient": 3,
            "stage": "recovery",
            "value": null,
            "err": null,
            "day": 11
        },
        {
            "patient": 4,
            "stage": "acute",
            "value": 2.18,
            "err": 0.11,
            "day": 15
        },
        {
            "patient": 5,
            "stage": "recovery",
            "value": 2.01,
            "err": 0.28,
            "day": 30
        }
    ]
}
